Location,Hotel Name,Stars,Rating,Review Keyword,Services,Property Offers
"Mexico City, Mexico",Camino Real Santa Fe,5.0,8.8,Excellent,"['Restaurant', 'Breakfast available', 'Bar', 'Spa', 'Parking available', 'Housekeeping']","{'Room Name': 'Deluxe Room, 1 King Bed (Wifi included)', 'Room Charges': '$81'}, {'Room Name': 'Deluxe Room, 2 Double Beds (Wifi included)', 'Room Charges': '$89'}, {'Room Name': 'Camino Real Club King', 'Room Charges': '$113'}, {'Room Name': 'Camino Real Club Doble', 'Room Charges': '$125'}, {'Room Name': 'Junior Suite, 1 King Bed', 'Room Charges': '$137'}"
"Mexico City, Mexico",Hyatt Regency Mexico City,5.0,9.4,Exceptional,"['Pool', 'Bar', 'Parking available', 'Spa', 'Parking included', 'Pet friendly']","{'Room Name': 'Room, 1 King Bed', 'Room Charges': '$250'}, {'Room Name': 'Room, 2 Twin Beds', 'Room Charges': '$250'}, {'Room Name': 'Room, 2 Twin Beds, Park View', 'Room Charges': '$281'}, {'Room Name': 'Club Room, 1 King Bed', 'Room Charges': '$337'}, {'Room Name': 'Club Room, 2 Twin Beds', 'Room Charges': '$337'}, {'Room Name': 'Club Room, 2 Twin Beds (High Floor)', 'Room Charges': '$350'}, {'Room Name': 'Club Room, 1 King Bed (High Floor)', 'Room Charges': '$350'}, {'Room Name': 'Room, 1 King Bed, Park View', 'Room Charges': '$351'}, {'Room Name': 'Regency, Suite, 1 King Bed', 'Room Charges': '$448'}, {'Room Name': 'Executive Suite', 'Room Charges': '$504'}"
"Mexico City, Mexico",Mondrian Mexico City Condesa,5.0,9.4,Exceptional,"['Restaurant', 'Breakfast available', 'Gym', 'Bar', 'Parking available', 'Pet friendly']","{'Room Name': 'Standard Room, 1 King Bed', 'Room Charges': '$215'}, {'Room Name': 'Standard Room, 2 Double Beds', 'Room Charges': '$215'}, {'Room Name': 'Superior Room, 1 King Bed', 'Room Charges': '$231'}, {'Room Name': 'Superior Room, 1 King Bed, Accessible', 'Room Charges': '$231'}, {'Room Name': 'Superior Room, 1 King Bed (Skyline)', 'Room Charges': '$247'}, {'Room Name': 'Superior Room, 2 Double Beds (Skyline)', 'Room Charges': '$247'}, {'Room Name': 'Suite, 1 King Bed, Corner (Corner)', 'Room Charges': '$327'}, {'Room Name': 'Suite, 1 King Bed, Terrace', 'Room Charges': '$343'}, {'Room Name': 'Superior Suite, 1 King Bed, Terrace', 'Room Charges': '$351'}"
"Mexico City, Mexico",Sofitel Mexico City Reforma,5.0,9.6,Exceptional,"['Breakfast available', 'Pool', 'Gym', 'Restaurant', 'Spa', 'Bar']","{'Room Name': 'Superior Room, 1 King Bed, City View', 'Room Charges': '$380'}, {'Room Name': 'Superior Room, 1 King Bed, View (Angel of Independence View)', 'Room Charges': '$401'}, {'Room Name': 'SUPERIOR ROOM, 2 double beds, Angel of Independence view', 'Room Charges': '$416'}, {'Room Name': 'SUPERIOR ROOM, 1 king bed, Angel of Independence skyline view', 'Room Charges': '$418'}, {'Room Name': 'SUPERIOR ROOM, 2 double beds, Angel of Independence skyline view', 'Room Charges': '$433'}, {'Room Name': 'Luxury Room, 1 King Bed, City View', 'Room Charges': '$435'}, {'Room Name': 'Luxury Room, 1 King Bed, View (Skyline View)', 'Room Charges': '$452'}, {'Room Name': 'LUXURY ROOM EXECUTIVE FLOOR, Club Millésime access, 1 king bed, skyline view', 'Room Charges': '$590'}, {'Room Name': 'SUPERIOR ROOM EXECUTIVE FLOOR, Club Millésime access, 1 king bed, skyline view', 'Room Charges': '$605'}, {'Room Name': 'JUNIOR SUITE EXECUTIVE FLOOR, Club Millésime access, 1 king bed, Reforma view', 'Room Charges': '$682'}, {'Room Name': 'JUNIOR SUITE EXECUTIVE FLOOR, Club Millésime access, 1 king bed, Angel of Independence view', 'Room Charges': '$708'}, {'Room Name': 'Club Room, 1 King Bed, Business Lounge Access (Prestige, Angel of Independence View)', 'Room Charges': '$786'}"
"Mexico City, Mexico","The Ritz-Carlton, Mexico City",5.0,9.2,Wonderful,"['Pool', 'Bar', 'Pet friendly', 'Parking available', 'Breakfast available', '24/7 front desk']","{'Room Name': 'Deluxe Room, 1 King Bed, Non Smoking, City View', 'Room Charges': '$513'}, {'Room Name': 'Deluxe Room, 2 Queen Beds, Non Smoking, City View', 'Room Charges': '$513'}, {'Room Name': 'Deluxe Room, 1 King Bed, Terrace, Park View', 'Room Charges': '$548'}, {'Room Name': 'Deluxe Room, 2 Queen Beds, Terrace, Park View', 'Room Charges': '$548'}, {'Room Name': 'Deluxe Room, 1 King Bed, City View, Corner', 'Room Charges': '$618'}, {'Room Name': 'Deluxe Room, 2 Queen Beds, City View, Corner', 'Room Charges': '$618'}, {'Room Name': 'Junior Suite, 2 Queen Beds, Park View (Corner, Terrace)', 'Room Charges': '$653'}, {'Room Name': 'Junior Suite, 1 King Bed, Park View, Corner', 'Room Charges': '$653'}, {'Room Name': 'Deluxe Room, 1 King Bed, Non Smoking, Park View', 'Room Charges': '$688'}, {'Room Name': 'Deluxe Room, 2 Queen Beds, Non Smoking, Park View', 'Room Charges': '$688'}, {'Room Name': 'Junior Suite, 1 King Bed, Terrace, Park View', 'Room Charges': '$793'}, {'Room Name': 'Executive Suite, 1 King Bed, Non Smoking, City View', 'Room Charges': '$1,049'}, {'Room Name': 'Luxury Suite, 1 King Bed, Non Smoking, Park View', 'Room Charges': '$2,999'}, {'Room Name': 'Royal Suite, 1 King Bed, Park View', 'Room Charges': '$4,999'}, {'Room Name': 'Club Suite, 1 King Bed', 'Room Charges': '$5,999'}"
"Mexico City, Mexico",JW Marriott Hotel Mexico City Polanco,5.0,9.4,Exceptional,"['Pool', 'Bar', 'Parking available', 'Pet friendly', 'Room service', 'Breakfast available']","{'Room Name': 'Executive Suite, 1 King Bed with Sofa bed, Non Smoking, Terrace', 'Room Charges': '$407'}, {'Room Name': 'Room, 1 King Bed, Non Smoking', 'Room Charges': '$407'}, {'Room Name': 'Room, 1 King Bed, Non Smoking', 'Room Charges': '$423'}, {'Room Name': 'Executive Room, 1 Double Bed, Non Smoking, Executive Level', 'Room Charges': '$487'}, {'Room Name': 'Executive Suite, 1 King Bed, Non Smoking, City View (Corner)', 'Room Charges': '$527'}, {'Room Name': 'Executive Suite, 1 Bedroom, Non Smoking', 'Room Charges': '$607'}, {'Room Name': 'Executive Suite, 1 Double Bed, Non Smoking, Executive Level', 'Room Charges': '$647'}, {'Room Name': 'Junior Suite, 1 King Bed, Non Smoking', 'Room Charges': '$683'}"
"Mexico City, Mexico",Live Aqua Ciudad de México Bosques de las Lomas,5.0,9.6,Exceptional,"['Bar', 'Spa', 'Pet friendly', 'Parking available', 'Housekeeping', '24/7 front desk']","{'Room Name': 'Deluxe Room, 1 King Bed', 'Room Charges': '$290'}, {'Room Name': 'Deluxe Double Room, 2 Double Beds', 'Room Charges': '$295'}, {'Room Name': 'Executive Suite, 1 King Bed', 'Room Charges': '$544'}, {'Room Name': 'Master Suite, One King Bed', 'Room Charges': '$631'}"
"Mexico City, Mexico",The St. Regis Mexico City,5.0,9.6,Exceptional,"['Breakfast available', 'Pool', 'Hot Tub', 'Bar', 'Pet friendly', 'Parking available']","{'Room Name': 'Deluxe Room, 2 Queen Beds', 'Room Charges': '$727'}, {'Room Name': 'Grand Room, 1 King Bed', 'Room Charges': '$767'}, {'Room Name': 'Signature Room, 1 King Bed', 'Room Charges': '$757'}, {'Room Name': 'Grand Room, 2 Queen Beds', 'Room Charges': '$777'}, {'Room Name': 'Executive Suite, 1 King Bed', 'Room Charges': '$901'}, {'Room Name': 'Junior Suite, 1 King Bed', 'Room Charges': '$1,034'}, {'Room Name': 'Luxury Suite, 1 King Bed', 'Room Charges': '$1,154'}"
"Mexico City, Mexico",Sofitel Mexico City Reforma,5.0,9.6,Exceptional,"['Breakfast available', 'Pool', 'Gym', 'Restaurant', 'Spa', 'Bar']","{'Room Name': 'Superior Room, 1 King Bed, City View', 'Room Charges': '$380'}, {'Room Name': 'Superior Room, 1 King Bed, View (Angel of Independence View)', 'Room Charges': '$401'}, {'Room Name': 'SUPERIOR ROOM, 2 double beds, Angel of Independence view', 'Room Charges': '$416'}, {'Room Name': 'SUPERIOR ROOM, 1 king bed, Angel of Independence skyline view', 'Room Charges': '$418'}, {'Room Name': 'SUPERIOR ROOM, 2 double beds, Angel of Independence skyline view', 'Room Charges': '$433'}, {'Room Name': 'Luxury Room, 1 King Bed, City View', 'Room Charges': '$435'}, {'Room Name': 'Luxury Room, 1 King Bed, View (Skyline View)', 'Room Charges': '$452'}, {'Room Name': 'LUXURY ROOM EXECUTIVE FLOOR, Club Millésime access, 1 king bed, skyline view', 'Room Charges': '$590'}, {'Room Name': 'SUPERIOR ROOM EXECUTIVE FLOOR, Club Millésime access, 1 king bed, skyline view', 'Room Charges': '$605'}, {'Room Name': 'JUNIOR SUITE EXECUTIVE FLOOR, Club Millésime access, 1 king bed, Reforma view', 'Room Charges': '$682'}, {'Room Name': 'JUNIOR SUITE EXECUTIVE FLOOR, Club Millésime access, 1 king bed, Angel of Independence view', 'Room Charges': '$708'}, {'Room Name': 'Club Room, 1 King Bed, Business Lounge Access (Prestige, Angel of Independence View)', 'Room Charges': '$786'}"
"Mexico City, Mexico","ANDAZ CONDESA MEXICO CITY, BY HYATT",5.0,9.0,Wonderful,"['Restaurant', 'Pool', 'Bar', 'Parking available', 'Pet friendly', 'Spa']","{'Room Name': 'Room, 1 King Bed', 'Room Charges': '$354'}, {'Room Name': 'Room, 1 King Bed, City View', 'Room Charges': '$382'}, {'Room Name': 'Room, 2 Double Beds, City View', 'Room Charges': '$382'}, {'Room Name': 'Room, 2 Double Beds', 'Room Charges': '$384'}, {'Room Name': 'Room, 1 King Bed (High Floor)', 'Room Charges': '$407'}, {'Room Name': 'Room, 2 Double Beds (High Floor)', 'Room Charges': '$407'}, {'Room Name': 'Suite (Andaz)', 'Room Charges': '$473'}, {'Room Name': 'Suite, City View', 'Room Charges': '$524'}"
"Mexico City, Mexico",Live Aqua Ciudad de México Bosques de las Lomas,5.0,9.6,Exceptional,"['Spa', 'Bar', 'Pet friendly', 'Parking available', 'Housekeeping', '24/7 front desk']","{'Room Name': 'Deluxe Room, 1 King Bed', 'Room Charges': '$290'}, {'Room Name': 'Deluxe Double Room, 2 Double Beds', 'Room Charges': '$295'}, {'Room Name': 'Executive Suite, 1 King Bed', 'Room Charges': '$544'}, {'Room Name': 'Master Suite, One King Bed', 'Room Charges': '$631'}"
"Mexico City, Mexico",JW Marriott Hotel Mexico City Polanco,5.0,9.4,Exceptional,"['Breakfast available', 'Pool', 'Bar', 'Parking available', 'Pet friendly', 'Room service']","{'Room Name': 'Executive Suite, 1 King Bed with Sofa bed, Non Smoking, Terrace', 'Room Charges': '$407'}, {'Room Name': 'Room, 1 King Bed, Non Smoking', 'Room Charges': '$407'}, {'Room Name': 'Room, 1 King Bed, Non Smoking', 'Room Charges': '$423'}, {'Room Name': 'Executive Room, 1 Double Bed, Non Smoking, Executive Level', 'Room Charges': '$487'}, {'Room Name': 'Executive Suite, 1 King Bed, Non Smoking, City View (Corner)', 'Room Charges': '$527'}, {'Room Name': 'Executive Suite, 1 Bedroom, Non Smoking', 'Room Charges': '$607'}, {'Room Name': 'Executive Suite, 1 Double Bed, Non Smoking, Executive Level', 'Room Charges': '$647'}, {'Room Name': 'Junior Suite, 1 King Bed, Non Smoking', 'Room Charges': '$683'}"
"Mexico City, Mexico",W Mexico City,5.0,8.8,Excellent,"['Hot Tub', 'Bar', 'Parking available', 'Spa', 'Pet friendly', 'Room service']","{'Room Name': 'Room, 1 King Bed, Non Smoking, City View', 'Room Charges': '$338'}, {'Room Name': 'Room, 2 Queen Beds, Non Smoking, City View', 'Room Charges': '$338'}, {'Room Name': 'Room, 2 Queen Beds, Non Smoking, City View', 'Room Charges': '$358'}, {'Room Name': 'Room, 1 King Bed, Non Smoking, City View', 'Room Charges': '$358'}, {'Room Name': 'Room, 1 King Bed, Non Smoking, City View', 'Room Charges': '$378'}, {'Room Name': 'Room, 2 Queen Beds, Non Smoking, City View', 'Room Charges': '$378'}, {'Room Name': 'Suite, 1 Bedroom, Non Smoking, City View (Corner)', 'Room Charges': '$438'}, {'Room Name': 'Suite, 1 Bedroom, Non Smoking, City View (Corner)', 'Room Charges': '$578'}, {'Room Name': 'Suite, 1 Bedroom, Non Smoking', 'Room Charges': '$698'}, {'Room Name': 'Penthouse, 1 King Bed, Non Smoking, City View', 'Room Charges': '$3,838'}"
"Mexico City, Mexico",Four Seasons Hotel Mexico City,5.0,9.4,Exceptional,"['Pool', 'Hot Tub', 'Bar', 'Pet friendly', 'Parking available', 'Breakfast available']","{'Room Name': 'Superior Room, 1 King Bed', 'Room Charges': '$533'}, {'Room Name': 'Deluxe Room, 1 King Bed', 'Room Charges': '$588'}, {'Room Name': 'Deluxe Room, 2 Double Beds', 'Room Charges': '$588'}, {'Room Name': 'Premier Room, 1 King Bed', 'Room Charges': '$802'}, {'Room Name': 'Premier Room, 1 King Bed, Terrace', 'Room Charges': '$902'}, {'Room Name': 'Executive Suite, Burdeos View', 'Room Charges': '$970'}, {'Room Name': 'Executive Suite, Reforma View', 'Room Charges': '$997'}, {'Room Name': 'Executive Suite, Courtyard View', 'Room Charges': '$1,037'}, {'Room Name': 'Suite, 1 Bedroom', 'Room Charges': '$1,343'}, {'Room Name': 'Governor Suite King', 'Room Charges': '$6,000'}, {'Room Name': 'Ambassador Suite', 'Room Charges': '$6,000'}, {'Room Name': 'Presidential Suite', 'Room Charges': '$8,000'}"
"Mexico City, Mexico",The St. Regis Mexico City,5.0,9.6,Exceptional,"['Breakfast available', 'Pool', 'Hot Tub', 'Bar', 'Pet friendly', 'Parking available']","{'Room Name': 'Deluxe Room, 2 Queen Beds', 'Room Charges': '$727'}, {'Room Name': 'Grand Room, 1 King Bed', 'Room Charges': '$767'}, {'Room Name': 'Signature Room, 1 King Bed', 'Room Charges': '$757'}, {'Room Name': 'Grand Room, 2 Queen Beds', 'Room Charges': '$777'}, {'Room Name': 'Executive Suite, 1 King Bed', 'Room Charges': '$901'}, {'Room Name': 'Junior Suite, 1 King Bed', 'Room Charges': '$1,034'}, {'Room Name': 'Luxury Suite, 1 King Bed', 'Room Charges': '$1,154'}"
"Mexico City, Mexico",Casa Polanco Hotel Boutique,5.0,10,Exceptional,"['Spa', 'Parking included', 'Room service', 'Breakfast included', 'Housekeeping', '24/7 front desk']","{'Room Name': 'Premier Patio View', 'Room Charges': '$999'}, {'Room Name': 'Premier Park View', 'Room Charges': '$1,192'}, {'Room Name': 'Grand Suite', 'Room Charges': '$1,337'}, {'Room Name': 'Premier Double Patio View', 'Room Charges': None}, {'Room Name': 'Deluxe King Size', 'Room Charges': None}, {'Room Name': 'Suite Polanco', 'Room Charges': None}, {'Room Name': 'Suite Lincoln', 'Room Charges': None}, {'Room Name': 'Suite Anatole', 'Room Charges': None}"
"Mexico City, Mexico","The Ritz-Carlton, Mexico City",5.0,9.2,Wonderful,"['Pool', 'Bar', 'Pet friendly', 'Parking available', 'Breakfast available', '24/7 front desk']","{'Room Name': 'Deluxe Room, 1 King Bed, Non Smoking, City View', 'Room Charges': '$513'}, {'Room Name': 'Deluxe Room, 2 Queen Beds, Non Smoking, City View', 'Room Charges': '$513'}, {'Room Name': 'Deluxe Room, 1 King Bed, Terrace, Park View', 'Room Charges': '$548'}, {'Room Name': 'Deluxe Room, 2 Queen Beds, Terrace, Park View', 'Room Charges': '$548'}, {'Room Name': 'Deluxe Room, 1 King Bed, City View, Corner', 'Room Charges': '$618'}, {'Room Name': 'Deluxe Room, 2 Queen Beds, City View, Corner', 'Room Charges': '$618'}, {'Room Name': 'Junior Suite, 2 Queen Beds, Park View (Corner, Terrace)', 'Room Charges': '$653'}, {'Room Name': 'Junior Suite, 1 King Bed, Park View, Corner', 'Room Charges': '$653'}, {'Room Name': 'Deluxe Room, 1 King Bed, Non Smoking, Park View', 'Room Charges': '$688'}, {'Room Name': 'Deluxe Room, 2 Queen Beds, Non Smoking, Park View', 'Room Charges': '$688'}, {'Room Name': 'Junior Suite, 1 King Bed, Terrace, Park View', 'Room Charges': '$793'}, {'Room Name': 'Executive Suite, 1 King Bed, Non Smoking, City View', 'Room Charges': '$1,049'}, {'Room Name': 'Luxury Suite, 1 King Bed, Non Smoking, Park View', 'Room Charges': '$2,999'}, {'Room Name': 'Royal Suite, 1 King Bed, Park View', 'Room Charges': '$4,999'}, {'Room Name': 'Club Suite, 1 King Bed', 'Room Charges': '$5,999'}"
"Mexico City, Mexico",Hotel Alexander,5.0,8.6,Excellent,"['Bar', 'Parking available', 'Spa', 'Room service', 'Breakfast available', 'Housekeeping']","{'Room Name': 'Suite, City View', 'Room Charges': '$620'}, {'Room Name': 'Suite, Park View', 'Room Charges': '$650'}, {'Room Name': 'Master Suite', 'Room Charges': '$700'}, {'Room Name': 'Ambassador Suite', 'Room Charges': '$790'}, {'Room Name': 'Alexander Suite', 'Room Charges': '$900'}"
"Mexico City, Mexico","Las Alcobas, a Luxury Collection Hotel, Mexico City",5.0,9.8,Exceptional,"['Spa', 'Parking included', 'Room service', 'Breakfast included', '24/7 front desk', 'Housekeeping']","{'Room Name': 'Premium Room, 1 King Bed, Non Smoking, Corner', 'Room Charges': '$768'}"
"Mexico City, Mexico",Hotel Casa Ensenada,5.0,9.6,,"['Breakfast included', 'Housekeeping', 'Air conditioning', 'Laundry', '24/7 front desk', 'Free WiFi']","{'Room Name': 'Grand Double Room, Courtyard View', 'Room Charges': '$200'}, {'Room Name': 'Premier Studio Suite, Courtyard View', 'Room Charges': '$215'}, {'Room Name': 'Grand Studio, Courtyard View', 'Room Charges': '$205'}, {'Room Name': 'Business Room, Balcony, City View', 'Room Charges': '$205'}, {'Room Name': 'Grand Double Room, City View', 'Room Charges': '$210'}, {'Room Name': 'Superior Room, Balcony, City View', 'Room Charges': '$215'}, {'Room Name': 'Superior Room, Courtyard View', 'Room Charges': '$215'}"
"Mexico City, Mexico",Barceló México Reforma,5.0,9.2,Wonderful,"['Breakfast available', 'Restaurant', 'Spa', 'Gym', 'Pool', 'Hot Tub']","{'Room Name': 'Superior Room', 'Room Charges': '$100'}, {'Room Name': 'Superior Executive', 'Room Charges': '$113'}, {'Room Name': 'Superior Premium Level', 'Room Charges': '$124'}, {'Room Name': 'Suite Premium Level', 'Room Charges': '$162'}, {'Room Name': 'Suite City View Premium Level', 'Room Charges': '$175'}"
"Mexico City, Mexico",Camino Real Polanco Mexico,5.0,9.4,Exceptional,"['Pool', 'Restaurant', 'Breakfast available', 'Gym', 'Spa', 'Parking included']","{'Room Name': 'Deluxe Dos Camas', 'Room Charges': '$219'}, {'Room Name': 'Deluxe King', 'Room Charges': '$224'}, {'Room Name': 'Deluxe Superior Two Beds', 'Room Charges': '$242'}, {'Room Name': 'Deluxe Superior King', 'Room Charges': '$245'}, {'Room Name': 'Deluxe Superior Garden View Two Beds', 'Room Charges': '$255'}, {'Room Name': 'Deluxe Superior Garden View King', 'Room Charges': '$259'}, {'Room Name': 'Camino Real Club Dos Camas', 'Room Charges': '$263'}, {'Room Name': 'Camino Real Club King', 'Room Charges': '$265'}, {'Room Name': 'Camino Real Club Superior Double', 'Room Charges': '$269'}, {'Room Name': 'Camino Real Club Superior King', 'Room Charges': '$271'}, {'Room Name': 'Junior Suite', 'Room Charges': '$276'}, {'Room Name': 'Suite Fiesta', 'Room Charges': '$289'}, {'Room Name': 'Junior Suite Superior', 'Room Charges': '$290'}, {'Room Name': 'Master Suite', 'Room Charges': '$307'}, {'Room Name': 'Camino Real Club Superior Double Garden View', 'Room Charges': '$312'}, {'Room Name': 'Camino Real Club Superior King Garden View', 'Room Charges': '$312'}, {'Room Name': 'Suite Chapultepec', 'Room Charges': '$317'}, {'Room Name': 'Suite Virreyes', 'Room Charges': '$346'}, {'Room Name': 'Suite Virreyes Superior', 'Room Charges': '$1,164'}"
"Mexico City, Mexico",Gran Hotel Ciudad de Mexico Zocalo View,5.0,9.8,Exceptional,"['Breakfast available', 'Restaurant', 'Bar', 'Parking available', 'Gym', 'Free WiFi']","{'Room Name': 'Deluxe Room, 1 King Bed', 'Room Charges': '$228'}, {'Room Name': 'Deluxe Double Room, 2 Double Beds', 'Room Charges': '$228'}, {'Room Name': 'Master Suite', 'Room Charges': '$261'}, {'Room Name': 'Junior Suite, 1 King Bed, Zocalo View', 'Room Charges': '$339'}, {'Room Name': 'Master Suite Zocalo View', 'Room Charges': '$373'}, {'Room Name': 'Super Saver One King', 'Room Charges': None}"
"Mexico City, Mexico",Marquis Reforma Hotel Spa,5.0,9.2,Wonderful,"['Pool', 'Bar', 'Breakfast available', 'Spa', 'Room service', 'Parking available']","{'Room Name': 'Deluxe Room, 1 King Bed', 'Room Charges': '$257'}, {'Room Name': 'Deluxe Room, 2 Double Beds', 'Room Charges': '$257'}, {'Room Name': 'Deluxe Superior Room, 1 King Bed', 'Room Charges': '$317'}, {'Room Name': 'Deluxe Superior Room, 2 Double Beds', 'Room Charges': '$317'}, {'Room Name': 'Junior Suite', 'Room Charges': '$334'}, {'Room Name': 'Junior Suite Corner', 'Room Charges': '$334'}, {'Room Name': 'Junior Superior Suite', 'Room Charges': '$410'}, {'Room Name': 'Sky Suite, 1 King Bed', 'Room Charges': '$531'}, {'Room Name': 'Sky Suite, 2 Double Beds', 'Room Charges': '$542'}, {'Room Name': 'Master Superior Suite', 'Room Charges': '$652'}, {'Room Name': 'Premium Loft', 'Room Charges': '$970'}, {'Room Name': 'Panoramic Sky Suite', 'Room Charges': '$1,123'}"
"Mexico City, Mexico",Le Méridien Mexico City Reforma,5.0,9.2,Wonderful,"['Restaurant', 'Breakfast available', 'Pool', 'Bar', 'Pet friendly', 'Spa']","{'Room Name': 'Classic Suite, 1 King Bed with Sofa bed, Non Smoking', 'Room Charges': '$117'}, {'Room Name': 'Classic Suite, 2 Double Beds, Non Smoking', 'Room Charges': '$124'}, {'Room Name': 'Superior Suite, 1 King Bed with Sofa bed, Non Smoking, City View', 'Room Charges': '$196'}, {'Room Name': 'Superior Suite, 2 Double Beds, Non Smoking, City View', 'Room Charges': '$206'}, {'Room Name': 'Premium Suite, 1 King Bed with Sofa bed, Non Smoking, City View', 'Room Charges': '$236'}, {'Room Name': 'Premium Suite, 1 King Bed with Sofa bed, Non Smoking, Corner', 'Room Charges': '$246'}"
"Mexico City, Mexico",Grand Fiesta Americana Chapultepec,5.0,9.4,Exceptional,"['Spa', 'Hot Tub', 'Bar', 'Housekeeping', 'Room service', 'Breakfast available']","{'Room Name': 'Deluxe Room, 1 King Bed', 'Room Charges': '$230'}, {'Room Name': 'Deluxe Double Room, 2 Double Beds', 'Room Charges': '$235'}, {'Room Name': 'Deluxe Double Room, 2 Double Beds, Park View', 'Room Charges': '$260'}, {'Room Name': 'Deluxe Room, 1 King Bed, Park View', 'Room Charges': '$263'}, {'Room Name': 'Grand Club, 2 Doubles', 'Room Charges': '$280'}, {'Room Name': 'Grand Club King', 'Room Charges': '$285'}, {'Room Name': 'Grand Club 2 Double, Park View', 'Room Charges': '$314'}, {'Room Name': 'Grand Club, 1 King Park View', 'Room Charges': '$320'}, {'Room Name': 'Junior Suite, 1 King Bed, Park View', 'Room Charges': '$405'}"
"Mexico City, Mexico",Hilton Mexico City Reforma,5.0,9.4,Exceptional,"['Breakfast available', 'Restaurant', 'Spa', 'Pool', 'Gym', 'Hot Tub']","{'Room Name': '2 double beds', 'Room Charges': '$273'}, {'Room Name': 'One king bed', 'Room Charges': '$277'}, {'Room Name': 'Room, 1 King Bed, Accessible', 'Room Charges': '$277'}, {'Room Name': 'Room, 1 King Bed, View', 'Room Charges': '$292'}, {'Room Name': 'Executive Room, 1 King Bed', 'Room Charges': '$351'}, {'Room Name': 'Executive Room, 2 Double Beds', 'Room Charges': '$351'}, {'Room Name': 'Executive Room, 1 King Bed, View', 'Room Charges': '$366'}, {'Room Name': 'Junior Suite, 1 King Bed', 'Room Charges': '$380'}, {'Room Name': 'Junior Suite, 2 Double Beds', 'Room Charges': '$380'}, {'Room Name': 'Business Suite, 1 King Bed', 'Room Charges': '$422'}, {'Room Name': 'Suite, 1 King Bed (Master Suite)', 'Room Charges': '$469'}, {'Room Name': 'Presidential Suite, 1 King Bed', 'Room Charges': None}"
"Mexico City, Mexico",The Paragon Hotel Mexico City Santa Fe By Accor,5.0,9.2,Wonderful,"['Pet friendly', 'Breakfast available', 'Housekeeping', 'Parking available', 'Air conditioning', 'Room service']","{'Room Name': 'Classic Room, 1 King Bed, City View', 'Room Charges': '$101'}, {'Room Name': 'Classic Room, 2 Queen Beds, City View', 'Room Charges': '$115'}, {'Room Name': 'Deluxe Room, 1 King Bed, City View', 'Room Charges': '$134'}, {'Room Name': 'Deluxe Room, 2 Queen Beds, City View', 'Room Charges': '$148'}, {'Room Name': 'Premier Room, 1 King Bed, City View', 'Room Charges': '$170'}, {'Room Name': 'Premier Room, 2 Queen Beds, City View', 'Room Charges': '$184'}, {'Room Name': 'Studio, Balcony, City View', 'Room Charges': '$221'}, {'Room Name': 'Studio, 1 King Bed, City View', 'Room Charges': '$221'}"
"Mexico City, Mexico",Fiesta Americana México Satélite,5.0,9.4,Exceptional,"['Bar', 'Parking available', 'Pet friendly', 'Breakfast available', 'Housekeeping', 'Air conditioning']","{'Room Name': 'Deluxe Room, 1 King Bed', 'Room Charges': '$150'}, {'Room Name': 'Deluxe Room, 2 Double Beds', 'Room Charges': '$150'}, {'Room Name': 'Deluxe Room (1 King View)', 'Room Charges': '$170'}, {'Room Name': 'Executive Room (1 King)', 'Room Charges': '$170'}, {'Room Name': 'Junior Suite (King)', 'Room Charges': '$202'}"
"Mexico City, Mexico","Umbral, a Curio Collection by Hilton",5.0,9.2,Wonderful,"['Restaurant', 'Pool', 'Hot Tub', 'Bar', 'Pet friendly', 'Gym']","{'Room Name': 'Room, 1 King Bed, Accessible (Roll-In Shower)', 'Room Charges': '$250'}, {'Room Name': 'Suite, 1 Bedroom', 'Room Charges': '$299'}, {'Room Name': 'Room, 1 Queen Bed', 'Room Charges': '$250'}, {'Room Name': 'Room, 2 Twin Beds (Indoor Balcony)', 'Room Charges': '$250'}, {'Room Name': 'Room, 1 King Bed', 'Room Charges': '$269'}, {'Room Name': 'Room, 1 King Bed (Indoor Balcony)', 'Room Charges': '$288'}, {'Room Name': 'Suite, 1 Bedroom, Balcony', 'Room Charges': '$313'}, {'Room Name': 'Premium Suite, 1 King Bed', 'Room Charges': '$323'}"
"Mexico City, Mexico",Hilton Mexico City Airport,5.0,10.0,Good,"['Free airport shuttle', 'Bar', 'Pet friendly', 'Housekeeping', 'Breakfast available', 'Free WiFi']","{'Room Name': 'Standard Room, 1 King Bed', 'Room Charges': '$194'}, {'Room Name': 'Room, Accessible', 'Room Charges': '$194'}, {'Room Name': 'Standard 2 Doubles', 'Room Charges': '$194'}, {'Room Name': 'Standard Room, 1 Queen Bed', 'Room Charges': '$194'}, {'Room Name': 'Executive Room, 2 Double Beds', 'Room Charges': '$219'}, {'Room Name': 'Executive Room, 1 King Bed', 'Room Charges': '$219'}, {'Room Name': 'Room, 2 Double Beds (Airstrip view)', 'Room Charges': '$229'}, {'Room Name': 'Room, 1 King Bed (Airstrip view)', 'Room Charges': '$229'}, {'Room Name': 'Junior Suite, 1 King Bed', 'Room Charges': '$239'}, {'Room Name': 'Suite, 1 King Bed', 'Room Charges': '$247'}"
